{
  "artifact_count": 66,
  "generated_at": "2026-06-29T01:17:59+00:00",
  "latest_by_kind": {
    "candidate-family": {
      "content_hash": "sha256:fc3e37d840dec897bb970a64ef6a4c0fedf34b261e7f8458fc2eb9dc56200dbb",
      "generated_at": "2026-06-29T01:17:59+00:00",
      "kind": "candidate-family",
      "path": "candidate-families/unassigned.md",
      "slug": "unassigned",
      "title": "Candidate family journal — unassigned",
      "topics": [
        "candidate-family",
        "unassigned"
      ]
    },
    "discovery-log": {
      "content_hash": "sha256:63c126a6ed72fcc901793800c737d9e7c995aeb39b824d191598da10a859bf61",
      "generated_at": "2026-06-29T01:17:59+00:00",
      "kind": "discovery-log",
      "path": "discovery-logs/2026/2026-06-29.md",
      "slug": "discovery-2026-06-29",
      "title": "Discovery log — 2026-06-29",
      "topics": [
        "discovery",
        "daily-log"
      ]
    },
    "frontier-report": {
      "content_hash": "sha256:54e223720317070be6a361cd9afb0737800f7fd29f6c1d3fbde411add64a49f2",
      "generated_at": "2026-06-29T01:17:59+00:00",
      "kind": "frontier-report",
      "path": "frontier-reports/2026/2026-06-29-frontier.md",
      "slug": "frontier-2026-06-29",
      "title": "Frontier health report — 2026-06-29",
      "topics": [
        "frontier",
        "diversity",
        "health"
      ]
    },
    "runtime-audit": {
      "content_hash": "sha256:942960e9cd7b18eea7377a0bf2b6273e7957bff322eb064e33b31b6a172a7812",
      "generated_at": "2026-06-29T01:17:59+00:00",
      "kind": "runtime-audit",
      "path": "runtime-audits/2026/2026-06-29-runtime.md",
      "slug": "runtime-2026-06-29",
      "title": "Runtime audit summary — 2026-06-29",
      "topics": [
        "runtime-audit",
        "operations"
      ]
    },
    "weekly-review": {
      "content_hash": "sha256:a9129339a6c3053594735ba7c862f519e1f35f57fc92711a3462bada680d1ad4",
      "generated_at": "2026-06-28T16:02:47+00:00",
      "kind": "weekly-review",
      "path": "weekly-reviews/2026/2026-W26-state-of-protean.md",
      "slug": "2026-W26-state-of-protean",
      "title": "State of Protean — 2026-W26",
      "topics": [
        "weekly",
        "state-of-protean"
      ]
    },
    "wetlab-rationale": {
      "content_hash": "sha256:a71c2a7aa204c614ca21fee09376fd3ef429cef2969f90e2fb992027dcf2d11b",
      "generated_at": null,
      "kind": "wetlab-rationale",
      "path": "wetlab-rationale/README.md",
      "slug": "README",
      "title": "README",
      "topics": []
    }
  },
  "manifest_hash": "sha256:3617727552a8f26b6936b1ac4a0504de217629b3d2ae19340ce92cdeee22143c",
  "schema_version": "protean.public-research-manifest.v1"
}
